{"protocolVersion":"1.0","agentId":"11111111-1111-4111-8111-111111111111","platform":"linux/amd64","modules":[{"moduleId":"mock.safe","capabilityId":"mock.safe","available":true,"implementation":"builtin","moduleVersion":"1.0.0","riskClasses":["PASSIVE"]}],"externalTools":[],"networkCapabilities":[],"artifactCapabilities":["streaming-sha256"]}
